<?xml version="1.0" encoding="UTF-8"?>
<xs:schema attributeFormDefault="unqualified" elementFormDefault="qualified" xmlns:xs="http://www.w3.org/2001/XMLSchema">
  <xs:element name="booksLibrary">
    <xs:complexType>
      <xs:sequence>
        <xs:element name="books" maxOccurs="unbounded" minOccurs="0">
          <xs:complexType>
            <xs:sequence>
              <xs:element type="xs:string" name="title"/>
              <xs:element type="xs:string" name="sub_title"/>
              <xs:element type="xs:string" name="edition"/>
              <xs:element name="authors">
                <xs:complexType>
                  <xs:sequence>
                    <xs:element type="xs:string" name="author"/>
                  </xs:sequence>
                </xs:complexType>
              </xs:element>
              <xs:element name="publisher">
                <xs:complexType>
                  <xs:sequence>
                    <xs:element type="xs:string" name="name"/>
                    <xs:element type="xs:short" name="year"/>
                  </xs:sequence>
                </xs:complexType>
              </xs:element>
              <xs:element type="xs:short" name="pages"/>
              <xs:element type="xs:long" name="isbn"/>
              <xs:element type="xs:string" name="price"/>
            </xs:sequence>
          </xs:complexType>
        </xs:element>
      </xs:sequence>
    </xs:complexType>
  </xs:element>
</xs:schema>